{
  "schemaVersion": 2,
  "kbVersion": "2.2.0",
  "bundleId": "nordic-myth-v2",
  "priority": 10,
  "updatedAt": "2026-07-04T20:00:00Z",
  "contentHash": "sha256:b6c70f7d22340f6b3fc1c1583f29301f1a3b9a940826bcca09b1946faff79a43",
  "claims": [
    {
      "id": "nordic-socialist",
      "topicId": "nordic-democratic-socialism",
      "topicPath": "/nordic-democratic-socialism",
      "title": "Nordic Countries Are Socialist",
      "socialistClaimText": "We should be like Sweden or Denmark - they prove democratic socialism works.",
      "executiveSummary": "Nordic nations are market economies with robust private property, open trade, and high business freedom scores. Sweden, Denmark, and Norway rank 'Mostly Free' on the Heritage Index - not socialist. High taxes fund generous welfare transfers; they do not collectively own the means of production. Danish PM Lars Løkke Rasmussen stated plainly: 'Denmark is a market economy.'",
      "evidenceBullets": [
        "Heritage Index of Economic Freedom 2024: Denmark 77.6, Sweden 74.8, Norway 69.6 - all 'Mostly Free' with strong property rights and trade freedom.",
        "Fraser Institute Economic Freedom of the World 2023: Nordic nations score above world average on legal system and property rights.",
        "World Bank Doing Business (legacy series): Nordics consistently top ease-of-doing-business before index suspension.",
        "Danish PM Lars Løkke Rasmussen (2015 Nordic Council): 'I would like to make some corrections... Denmark is a market economy.'"
      ],
      "fallacies": [
        "definitional sleight of hand",
        "equivocation",
        "cherry-picking"
      ],
      "sources": [
        {
          "id": "heritage-index-2024",
          "title": "Heritage Foundation - Index of Economic Freedom 2024",
          "url": "https://www.heritage.org/index/ranking",
          "doi": null,
          "type": "think_tank",
          "accessedAt": "2026-07-04",
          "citation": "Heritage Foundation, Index of Economic Freedom 2024, country rankings."
        },
        {
          "id": "fraser-efw-2023",
          "title": "Fraser Institute - Economic Freedom of the World 2023",
          "url": "https://www.fraserinstitute.org/studies/economic-freedom",
          "doi": null,
          "type": "think_tank",
          "accessedAt": "2026-07-04",
          "citation": "Fraser Institute, Economic Freedom of the World 2023 Annual Report."
        },
        {
          "id": "danish-pm-market-economy",
          "title": "Lars Løkke Rasmussen - Nordic Council speech (2015)",
          "url": "https://www.thelocal.dk/20151031/danish-pm-i-know-that-some-people-in-the-us-associate-the-nordic-model-with-some-sort-of-socialism",
          "doi": null,
          "type": "primary",
          "accessedAt": "2026-07-04",
          "citation": "Danish PM Lars Løkke Rasmussen, Nordic Council address, October 2015."
        }
      ],
      "whyItMatters": "Mislabeling prosperous market economies as 'socialist' leads Americans to import the wrong policies - high taxes without the underlying economic freedom that generates the wealth to tax.",
      "relatedClaimIds": [
        "nordic-capitalist",
        "democratic-socialism-definition"
      ],
      "tags": [
        "nordic",
        "sweden",
        "denmark",
        "democratic-socialism",
        "economic-freedom"
      ],
      "schemaVersion": 2,
      "revision": 2,
      "updatedAt": "2026-07-04T18:00:00Z",
      "embeddingText": "Nordic countries socialist Sweden Denmark market economy Heritage Index Fraser economic freedom Danish PM",
      "searchText": "Nordic Countries Are Socialist Sweden Denmark market economy Heritage Fraser democratic socialism",
      "kbVersion": "2.2.0"
    },
    {
      "id": "nordic-capitalist",
      "topicId": "nordic-democratic-socialism",
      "topicPath": "/nordic-democratic-socialism",
      "title": "Nordic Prosperity Proves Socialism Works",
      "socialistClaimText": "Nordic prosperity and low inequality prove that socialism - or at least heavy redistribution - creates wealth.",
      "executiveSummary": "Nordic prosperity predates the modern welfare state. Sweden and Denmark were among Europe's richest nations by the late 19th century through free trade and market liberalization. Post-1990 crises forced market reforms: Sweden reformed pensions, school vouchers, and tax structure after its 1990s banking crisis; Denmark maintains flexicurity labor markets with employer flexibility.",
      "evidenceBullets": [
        "Maddison Project / World Bank historical GDP: Sweden and Denmark were high-income before 1960 welfare expansion.",
        "Swedish banking crisis (1990-1993): prompted pension privatization, school choice reforms, and corporate tax cuts.",
        "OECD Employment Outlook: Danish 'flexicurity' combines easy hiring/firing with active labor market policy - not job protection socialism.",
        "World Bank: Nordic GDP per capita growth correlated with trade openness (exports/GDP among highest in OECD)."
      ],
      "fallacies": [
        "post hoc ergo propter hoc",
        "correlation-causation",
        "historical cherry-picking"
      ],
      "sources": [
        {
          "id": "wb-historical-gdp-nordic",
          "title": "World Bank - Historical GDP per capita (Sweden, Denmark)",
          "url": "https://data.worldbank.org/indicator/NY.GDP.PCAP.KD?locations=SE-DK",
          "doi": null,
          "type": "government",
          "accessedAt": "2026-07-04",
          "citation": "World Bank Open Data, Sweden and Denmark GDP per capita series."
        },
        {
          "id": "oecd-flexicurity",
          "title": "OECD - Denmark: Labour Market and Social Policies (flexicurity)",
          "url": "https://www.oecd.org/denmark/",
          "doi": null,
          "type": "government",
          "accessedAt": "2026-07-04",
          "citation": "OECD, Denmark labour market policy reviews."
        },
        {
          "id": "riksbank-crisis-1990s",
          "title": "Sveriges Riksbank - The Swedish Banking Crisis (historical review)",
          "url": "https://www.riksbank.se/en-gb/press-and-published/notable-publications/",
          "doi": null,
          "type": "government",
          "accessedAt": "2026-07-04",
          "citation": "Sveriges Riksbank, Swedish financial crisis 1990s and reform period."
        }
      ],
      "whyItMatters": "Credit for Nordic living standards belongs to centuries of market institutions and trade - not to redistribution alone. Copying welfare without copying economic freedom yields different results.",
      "relatedClaimIds": [
        "nordic-socialist",
        "democratic-socialism-definition"
      ],
      "tags": [
        "nordic",
        "prosperity",
        "sweden",
        "welfare-state",
        "flexicurity"
      ],
      "schemaVersion": 2,
      "revision": 2,
      "updatedAt": "2026-07-04T18:00:00Z",
      "embeddingText": "Nordic prosperity socialism works welfare state Sweden 1990s crisis reforms flexicurity World Bank historical GDP",
      "searchText": "Nordic Prosperity Proves Socialism Works Sweden welfare flexicurity World Bank OECD reforms",
      "kbVersion": "2.2.0"
    },
    {
      "id": "democratic-socialism-definition",
      "topicId": "nordic-democratic-socialism",
      "topicPath": "/nordic-democratic-socialism",
      "title": "Democratic Socialism Is Just Scandinavian Welfare",
      "socialistClaimText": "When Americans say democratic socialism, they just mean a welfare state like Scandinavia - nothing radical.",
      "executiveSummary": "Modern democratic socialist organizations explicitly advocate worker ownership, decommodification of labor, and public ownership beyond Nordic tax-and-transfer models. The Democratic Socialists of America (DSA) platform calls for nationalizing utilities, worker cooperatives replacing corporate ownership, and abolishing private health insurance. Nordic leaders consistently reject the socialist label.",
      "evidenceBullets": [
        "DSA official platform: advocates 'democratic control over the economy' including worker cooperatives and decommodified housing/healthcare.",
        "Bernie Sanders 2020 platform: included employee ownership funds, Medicare for All abolishing private insurance - beyond Nordic systems.",
        "Swedish PM Stefan Löfven (2013): rejected socialist label - Sweden built success on 'competitive industry.'",
        "Cato Institute comparison: Nordic healthcare uses copays, private providers, and market elements absent from M4A proposals."
      ],
      "fallacies": [
        "motte and bailey",
        "equivocation",
        "straw man (moderate) / steel man (radical)"
      ],
      "sources": [
        {
          "id": "dsa-platform",
          "title": "Democratic Socialists of America - About / What We Stand For",
          "url": "https://www.dsausa.org/about-us/what-is-democratic-socialism/",
          "doi": null,
          "type": "primary",
          "accessedAt": "2026-07-04",
          "citation": "Democratic Socialists of America, What is Democratic Socialism?"
        },
        {
          "id": "cato-nordic-healthcare",
          "title": "Cato Institute - Nordic Healthcare Is Not Single-Payer Like M4A",
          "url": "https://www.cato.org/blog/scandinavian-universal-health-care-facts-myths",
          "doi": null,
          "type": "think_tank",
          "accessedAt": "2026-07-04",
          "citation": "Cato Institute, Scandinavian universal health care - facts and myths."
        },
        {
          "id": "lofven-market-economy",
          "title": "Stefan Löfven - Sweden built on competitive industry (Reuters, 2013)",
          "url": "https://www.reuters.com/article/us-sweden-politics-idUSBRE98I0K620130929",
          "doi": null,
          "type": "primary",
          "accessedAt": "2026-07-04",